{
  "definition_version": "1.0.0",
  "dimension_id": "relationships",
  "status": "typed",
  "core_question": "Who do they know and how warm or active are those ties?",
  "primary_entity_types": [
    {
      "id": "RelationshipEdge",
      "description": "Typed link between the owner and another person or organization.",
      "fields": [
        "target_entity_id",
        "tier",
        "warmth_band",
        "cadence_band",
        "last_interaction_at"
      ]
    },
    {
      "id": "NetworkCluster",
      "description": "A group of related contacts (work, social, family band).",
      "fields": [
        "cluster_label",
        "member_count",
        "dominant_context"
      ]
    },
    {
      "id": "ContactRecord",
      "description": "A saved way to reach someone: the name held and the identifiers under it.",
      "fields": [
        "display_name",
        "identifier",
        "identifier_type",
        "last_verified_at"
      ]
    }
  ],
  "signal_objects": [
    "relationship_edges",
    "warmth_score",
    "relationship_tier",
    "relationship_narrative_summary",
    "entity_dossier",
    "relationship_edge_summary",
    "person_reading"
  ],
  "gate_objects": [
    "warmth_score",
    "relationship_tier",
    "relationship_edge_summary"
  ],
  "canonical_contributions": {
    "conversation_messages": {
      "primary_weight": 0.9,
      "secondary_dimensions": [
        "memory",
        "interests"
      ]
    },
    "contacts": {
      "primary_weight": 1.0,
      "secondary_dimensions": [
        "profile"
      ]
    },
    "contact_identifiers": {
      "primary_weight": 0.8
    },
    "relationship_edges": {
      "primary_weight": 1.0
    },
    "journal_entries": {
      "primary_weight": 0.6,
      "secondary_dimensions": [
        "time",
        "work"
      ],
      "weight_fields": [
        "people",
        "entry_at"
      ]
    }
  },
  "view_types": [
    "relationship_graph",
    "tier_summary",
    "narrative_brief_optional"
  ],
  "extraction_hints": "Relationship tiers and interaction cadence bands; no contact names or message excerpts in inference-safe outputs."
}
